Difficulty,Title,Frequency,Acceptance Rate,Link,Topics
EASY,Two Sum,68.8,0.5577700123841364,https://leetcode.com/problems/two-sum,"Array, Hash Table"
EASY,Merge Two Sorted Lists,60.0,0.6684090455626255,https://leetcode.com/problems/merge-two-sorted-lists,"Linked List, Recursion"
EASY,Remove Duplicates from Sorted Array,53.1,0.6035557381927802,https://leetcode.com/problems/remove-duplicates-from-sorted-array,"Array, Two Pointers"
EASY,Next Greater Element I,53.1,0.7451247376157817,https://leetcode.com/problems/next-greater-element-i,"Array, Hash Table, Stack, Monotonic Stack"
EASY,Number of Students Unable to Eat Lunch,53.1,0.7873290271095185,https://leetcode.com/problems/number-of-students-unable-to-eat-lunch,"Array, Stack, Queue, Simulation"
EASY,Best Time to Buy and Sell Stock,43.5,0.5525962294861477,https://leetcode.com/problems/best-time-to-buy-and-sell-stock,"Array, Dynamic Programming"
EASY,Same Tree,43.5,0.6512687632792382,https://leetcode.com/problems/same-tree,"Tree, Depth-First Search, Breadth-First Search, Binary Tree"
EASY,Last Stone Weight,43.5,0.6592869343167317,https://leetcode.com/problems/last-stone-weight,"Array, Heap (Priority Queue)"
EASY,Crawler Log Folder,43.5,0.7160418239109896,https://leetcode.com/problems/crawler-log-folder,"Array, String, Stack"
EASY,Majority Element,43.5,0.657403169331404,https://leetcode.com/problems/majority-element,"Array, Hash Table, Divide and Conquer, Sorting, Counting"
MEDIUM,Transform Array to All Equal Elements,100.0,0.315568937398068,https://leetcode.com/problems/transform-array-to-all-equal-elements,"Array, Greedy"
MEDIUM,Shortest Bridge,97.5,0.5864849244498144,https://leetcode.com/problems/shortest-bridge,"Array, Depth-First Search, Breadth-First Search, Matrix"
MEDIUM,Maximum Points You Can Obtain from Cards,93.2,0.5563702302112898,https://leetcode.com/problems/maximum-points-you-can-obtain-from-cards,"Array, Sliding Window, Prefix Sum"
MEDIUM,Minimum Number of Coins to be Added,83.9,0.5669380799091082,https://leetcode.com/problems/minimum-number-of-coins-to-be-added,"Array, Greedy, Sorting"
MEDIUM,Numbers With Same Consecutive Differences,81.5,0.5874121948872566,https://leetcode.com/problems/numbers-with-same-consecutive-differences,"Backtracking, Breadth-First Search"
MEDIUM,Capacity To Ship Packages Within D Days,81.5,0.721177358490566,https://leetcode.com/problems/capacity-to-ship-packages-within-d-days,"Array, Binary Search"
MEDIUM,Minimum Limit of Balls in a Bag,81.5,0.6729582611405128,https://leetcode.com/problems/minimum-limit-of-balls-in-a-bag,"Array, Binary Search"
MEDIUM,Minimum Cost to Reach City With Discounts,81.5,0.5989514378011969,https://leetcode.com/problems/minimum-cost-to-reach-city-with-discounts,"Graph, Heap (Priority Queue), Shortest Path"
MEDIUM,Container With Most Water,79.5,0.5778283848079859,https://leetcode.com/problems/container-with-most-water,"Array, Two Pointers, Greedy"
MEDIUM,Longest Substring Without Repeating Characters,76.7,0.3693616634121832,https://leetcode.com/problems/longest-substring-without-repeating-characters,"Hash Table, String, Sliding Window"
MEDIUM,Koko Eating Bananas,75.9,0.4906724085014297,https://leetcode.com/problems/koko-eating-bananas,"Array, Binary Search"
MEDIUM,Asteroid Collision,75.9,0.4550058166209298,https://leetcode.com/problems/asteroid-collision,"Array, Stack, Simulation"
MEDIUM,Gas Station,71.5,0.4638362080309398,https://leetcode.com/problems/gas-station,"Array, Greedy"
MEDIUM,Product of Array Except Self,69.7,0.6777996139428187,https://leetcode.com/problems/product-of-array-except-self,"Array, Prefix Sum"
MEDIUM,Course Schedule,65.4,0.4923440720817781,https://leetcode.com/problems/course-schedule,"Depth-First Search, Breadth-First Search, Graph, Topological Sort"
MEDIUM,Number of Islands,65.4,0.6232001096557939,https://leetcode.com/problems/number-of-islands,"Array, Depth-First Search, Breadth-First Search, Union Find, Matrix"
MEDIUM,Course Schedule II,64.5,0.5342350029047974,https://leetcode.com/problems/course-schedule-ii,"Depth-First Search, Breadth-First Search, Graph, Topological Sort"
MEDIUM,Sum of Subarray Minimums,64.5,0.3762351166424223,https://leetcode.com/problems/sum-of-subarray-minimums,"Array, Dynamic Programming, Stack, Monotonic Stack"
MEDIUM,Rotting Oranges,64.2,0.5661841837717154,https://leetcode.com/problems/rotting-oranges,"Array, Breadth-First Search, Matrix"
MEDIUM,3Sum Closest,61.9,0.4688693274952354,https://leetcode.com/problems/3sum-closest,"Array, Two Pointers, Sorting"
MEDIUM,Magnetic Force Between Two Balls,61.9,0.7134574135311467,https://leetcode.com/problems/magnetic-force-between-two-balls,"Array, Binary Search, Sorting"
MEDIUM,Edit Distance,61.9,0.5878980645167777,https://leetcode.com/problems/edit-distance,"String, Dynamic Programming"
MEDIUM,Ways to Split Array Into Good Subarrays,61.9,0.3387961818897744,https://leetcode.com/problems/ways-to-split-array-into-good-subarrays,"Array, Math, Dynamic Programming"
MEDIUM,Partition Equal Subset Sum,60.0,0.4844389765822093,https://leetcode.com/problems/partition-equal-subset-sum,"Array, Dynamic Programming"
MEDIUM,Subarray Sum Equals K,60.0,0.4547620144808089,https://leetcode.com/problems/subarray-sum-equals-k,"Array, Hash Table, Prefix Sum"
MEDIUM,Reverse Substrings Between Each Pair of Parentheses,60.0,0.717268529079912,https://leetcode.com/problems/reverse-substrings-between-each-pair-of-parentheses,"String, Stack"
MEDIUM,Sort Colors,60.0,0.675831142046278,https://leetcode.com/problems/sort-colors,"Array, Two Pointers, Sorting"
MEDIUM,Binary Tree Zigzag Level Order Traversal,60.0,0.6168287046375325,https://leetcode.com/problems/binary-tree-zigzag-level-order-traversal,"Tree, Breadth-First Search, Binary Tree"
MEDIUM,Decode Ways,58.7,0.3653093731038959,https://leetcode.com/problems/decode-ways,"String, Dynamic Programming"
MEDIUM,Maximum Width of Binary Tree,58.7,0.4412945133765235,https://leetcode.com/problems/maximum-width-of-binary-tree,"Tree, Depth-First Search, Breadth-First Search, Binary Tree"
MEDIUM,Open the Lock,53.1,0.6074112952607815,https://leetcode.com/problems/open-the-lock,"Array, Hash Table, String, Breadth-First Search"
MEDIUM,01 Matrix,53.1,0.514765516483987,https://leetcode.com/problems/01-matrix,"Array, Dynamic Programming, Breadth-First Search, Matrix"
MEDIUM,Rank Teams by Votes,53.1,0.5940446839336095,https://leetcode.com/problems/rank-teams-by-votes,"Array, Hash Table, String, Sorting, Counting"
MEDIUM,House Robber,53.1,0.5230498170963667,https://leetcode.com/problems/house-robber,"Array, Dynamic Programming"
MEDIUM,Predict the Winner,53.1,0.5574273878146738,https://leetcode.com/problems/predict-the-winner,"Array, Math, Dynamic Programming, Recursion, Game Theory"
MEDIUM,3Sum,53.1,0.3707096702917142,https://leetcode.com/problems/3sum,"Array, Two Pointers, Sorting"
MEDIUM,Merge Intervals,53.1,0.4939523886258747,https://leetcode.com/problems/merge-intervals,"Array, Sorting"
MEDIUM,Word Break,53.1,0.4827378020649074,https://leetcode.com/problems/word-break,"Array, Hash Table, String, Dynamic Programming, Trie, Memoization"
MEDIUM,Amount of Time for Binary Tree to Be Infected,53.1,0.6373515517663223,https://leetcode.com/problems/amount-of-time-for-binary-tree-to-be-infected,"Hash Table, Tree, Depth-First Search, Breadth-First Search, Binary Tree"
MEDIUM,Search in Rotated Sorted Array,53.1,0.4283723492886359,https://leetcode.com/problems/search-in-rotated-sorted-array,"Array, Binary Search"
MEDIUM,Lowest Common Ancestor of a Binary Tree,53.1,0.6675500351250214,https://leetcode.com/problems/lowest-common-ancestor-of-a-binary-tree,"Tree, Depth-First Search, Binary Tree"
MEDIUM,Jump Game,51.6,0.3947922810402424,https://leetcode.com/problems/jump-game,"Array, Dynamic Programming, Greedy"
MEDIUM,Find Peak Element,51.6,0.465092325586426,https://leetcode.com/problems/find-peak-element,"Array, Binary Search"
MEDIUM,Copy List with Random Pointer,51.6,0.6053673680169267,https://leetcode.com/problems/copy-list-with-random-pointer,"Hash Table, Linked List"
MEDIUM,Path Sum III,43.5,0.460913846032227,https://leetcode.com/problems/path-sum-iii,"Tree, Depth-First Search, Binary Tree"
MEDIUM,Rotate Array,43.5,0.4302139583343225,https://leetcode.com/problems/rotate-array,"Array, Math, Two Pointers"
MEDIUM,Binary Tree Right Side View,43.5,0.6704260063500933,https://leetcode.com/problems/binary-tree-right-side-view,"Tree, Depth-First Search, Breadth-First Search, Binary Tree"
MEDIUM,Minimum Number of Arrows to Burst Balloons,43.5,0.6039233260349853,https://leetcode.com/problems/minimum-number-of-arrows-to-burst-balloons,"Array, Greedy, Sorting"
MEDIUM,Surrounded Regions,43.5,0.4288647280844804,https://leetcode.com/problems/surrounded-regions,"Array, Depth-First Search, Breadth-First Search, Union Find, Matrix"
MEDIUM,Longest Consecutive Sequence,43.5,0.4704085799928127,https://leetcode.com/problems/longest-consecutive-sequence,"Array, Hash Table, Union Find"
MEDIUM,Filling Bookcase Shelves,43.5,0.68655511990517,https://leetcode.com/problems/filling-bookcase-shelves,"Array, Dynamic Programming"
MEDIUM,Populating Next Right Pointers in Each Node,43.5,0.654415150988742,https://leetcode.com/problems/populating-next-right-pointers-in-each-node,"Linked List, Tree, Depth-First Search, Breadth-First Search, Binary Tree"
MEDIUM,Maximum Sum Circular Subarray,43.5,0.4766973516813795,https://leetcode.com/problems/maximum-sum-circular-subarray,"Array, Divide and Conquer, Dynamic Programming, Queue, Monotonic Queue"
MEDIUM,Minimum Area Rectangle,43.5,0.5500425559774781,https://leetcode.com/problems/minimum-area-rectangle,"Array, Hash Table, Math, Geometry, Sorting"
MEDIUM,Kth Largest Element in an Array,43.5,0.6797703525274048,https://leetcode.com/problems/kth-largest-element-in-an-array,"Array, Divide and Conquer, Sorting, Heap (Priority Queue), Quickselect"
MEDIUM,Jump Game II,43.5,0.4150333256039337,https://leetcode.com/problems/jump-game-ii,"Array, Dynamic Programming, Greedy"
MEDIUM,Furthest Building You Can Reach,43.5,0.5037126005703128,https://leetcode.com/problems/furthest-building-you-can-reach,"Array, Greedy, Heap (Priority Queue)"
MEDIUM,Car Pooling,43.5,0.560495041492097,https://leetcode.com/problems/car-pooling,"Array, Sorting, Heap (Priority Queue), Simulation, Prefix Sum"
MEDIUM,Minimum Cost For Tickets,43.5,0.6741371575291961,https://leetcode.com/problems/minimum-cost-for-tickets,"Array, Dynamic Programming"
MEDIUM,Minimum Number of Days to Make m Bouquets,43.5,0.5546586206278776,https://leetcode.com/problems/minimum-number-of-days-to-make-m-bouquets,"Array, Binary Search"
MEDIUM,Longest Repeating Character Replacement,43.5,0.5721164473504917,https://leetcode.com/problems/longest-repeating-character-replacement,"Hash Table, String, Sliding Window"
MEDIUM,Different Ways to Add Parentheses,43.5,0.7235302545489278,https://leetcode.com/problems/different-ways-to-add-parentheses,"Math, String, Dynamic Programming, Recursion, Memoization"
MEDIUM,Rotate Image,43.5,0.7790164128488621,https://leetcode.com/problems/rotate-image,"Array, Math, Matrix"
MEDIUM,Longest String Chain,43.5,0.6201512673699018,https://leetcode.com/problems/longest-string-chain,"Array, Hash Table, Two Pointers, String, Dynamic Programming, Sorting"
MEDIUM,Unique Paths II,41.7,0.4315424243087263,https://leetcode.com/problems/unique-paths-ii,"Array, Dynamic Programming, Matrix"
MEDIUM,All Nodes Distance K in Binary Tree,41.7,0.6644212959298368,https://leetcode.com/problems/all-nodes-distance-k-in-binary-tree,"Hash Table, Tree, Depth-First Search, Breadth-First Search, Binary Tree"
MEDIUM,Path Sum II,41.7,0.6049784432085769,https://leetcode.com/problems/path-sum-ii,"Backtracking, Tree, Depth-First Search, Binary Tree"
MEDIUM,Daily Temperatures,41.7,0.6736502832589849,https://leetcode.com/problems/daily-temperatures,"Array, Stack, Monotonic Stack"
HARD,Smallest Range Covering Elements from K Lists,100.0,0.6974692747987687,https://leetcode.com/problems/smallest-range-covering-elements-from-k-lists,"Array, Hash Table, Greedy, Sliding Window, Sorting, Heap (Priority Queue)"
HARD,Trapping Rain Water,94.9,0.6510201042238819,https://leetcode.com/problems/trapping-rain-water,"Array, Two Pointers, Dynamic Programming, Stack, Monotonic Stack"
HARD,Design Movie Rental System,83.9,0.3550989216268999,https://leetcode.com/problems/design-movie-rental-system,"Array, Hash Table, Design, Heap (Priority Queue), Ordered Set"
HARD,The Score of Students Solving Math Expression,81.5,0.3321676932247168,https://leetcode.com/problems/the-score-of-students-solving-math-expression,"Array, Math, String, Dynamic Programming, Stack, Memoization"
HARD,Triples with Bitwise AND Equal To Zero,81.5,0.593273081502327,https://leetcode.com/problems/triples-with-bitwise-and-equal-to-zero,"Array, Hash Table, Bit Manipulation"
HARD,Minimum Total Cost to Make Arrays Unequal,79.5,0.4050688867604803,https://leetcode.com/problems/minimum-total-cost-to-make-arrays-unequal,"Array, Hash Table, Greedy, Counting"
HARD,Binary Tree Maximum Path Sum,75.9,0.4122428295975244,https://leetcode.com/problems/binary-tree-maximum-path-sum,"Dynamic Programming, Tree, Depth-First Search, Binary Tree"
HARD,Cherry Pickup II,73.5,0.7196542271599925,https://leetcode.com/problems/cherry-pickup-ii,"Array, Dynamic Programming, Matrix"
HARD,Minimum Adjacent Swaps for K Consecutive Ones,73.5,0.4208017478234963,https://leetcode.com/problems/minimum-adjacent-swaps-for-k-consecutive-ones,"Array, Greedy, Sliding Window, Prefix Sum"
HARD,Strong Password Checker,69.7,0.1462273021710512,https://leetcode.com/problems/strong-password-checker,"String, Greedy, Heap (Priority Queue)"
HARD,Create Maximum Number,69.7,0.3249475515071097,https://leetcode.com/problems/create-maximum-number,"Array, Two Pointers, Stack, Greedy, Monotonic Stack"
HARD,Maximum Profit in Job Scheduling,64.2,0.5441702810721643,https://leetcode.com/problems/maximum-profit-in-job-scheduling,"Array, Binary Search, Dynamic Programming, Sorting"
HARD,Dungeon Game,60.0,0.3949585700362227,https://leetcode.com/problems/dungeon-game,"Array, Dynamic Programming, Matrix"
HARD,Find K-th Smallest Pair Distance,60.0,0.4579239829015915,https://leetcode.com/problems/find-k-th-smallest-pair-distance,"Array, Two Pointers, Binary Search, Sorting"
HARD,Largest Rectangle in Histogram,60.0,0.4737762011419101,https://leetcode.com/problems/largest-rectangle-in-histogram,"Array, Stack, Monotonic Stack"
HARD,Median of Two Sorted Arrays,58.7,0.4381458586755004,https://leetcode.com/problems/median-of-two-sorted-arrays,"Array, Binary Search, Divide and Conquer"
HARD,First Missing Positive,58.7,0.4108465766394882,https://leetcode.com/problems/first-missing-positive,"Array, Hash Table"
HARD,Burst Balloons,58.7,0.6131500044712985,https://leetcode.com/problems/burst-balloons,"Array, Dynamic Programming"
HARD,Candy,53.1,0.4669985426363719,https://leetcode.com/problems/candy,"Array, Greedy"
HARD,Maximal Rectangle,53.1,0.5370849969586674,https://leetcode.com/problems/maximal-rectangle,"Array, Dynamic Programming, Stack, Matrix, Monotonic Stack"
HARD,Cherry Pickup,53.1,0.3786948581341589,https://leetcode.com/problems/cherry-pickup,"Array, Dynamic Programming, Matrix"
HARD,Maximum Performance of a Team,53.1,0.4751514702683188,https://leetcode.com/problems/maximum-performance-of-a-team,"Array, Greedy, Sorting, Heap (Priority Queue)"
HARD,Cut Off Trees for Golf Event,53.1,0.3533426885924877,https://leetcode.com/problems/cut-off-trees-for-golf-event,"Array, Breadth-First Search, Heap (Priority Queue), Matrix"
HARD,Reconstruct Itinerary,51.6,0.4360564496598489,https://leetcode.com/problems/reconstruct-itinerary,"Depth-First Search, Graph, Eulerian Circuit"
HARD,Find Median from Data Stream,43.5,0.5327809111719406,https://leetcode.com/problems/find-median-from-data-stream,"Two Pointers, Design, Sorting, Heap (Priority Queue), Data Stream"
HARD,Course Schedule III,43.5,0.4067244024219053,https://leetcode.com/problems/course-schedule-iii,"Array, Greedy, Sorting, Heap (Priority Queue)"
HARD,Sliding Window Maximum,43.5,0.47604137491635,https://leetcode.com/problems/sliding-window-maximum,"Array, Queue, Sliding Window, Heap (Priority Queue), Monotonic Queue"
HARD,Sliding Window Median,43.5,0.3869197901499727,https://leetcode.com/problems/sliding-window-median,"Array, Hash Table, Sliding Window, Heap (Priority Queue)"
HARD,Minimum Number of Taps to Open to Water a Garden,43.5,0.5071699895141073,https://leetcode.com/problems/minimum-number-of-taps-to-open-to-water-a-garden,"Array, Dynamic Programming, Greedy"
HARD,Put Marbles in Bags,43.5,0.72440073755378,https://leetcode.com/problems/put-marbles-in-bags,"Array, Greedy, Sorting, Heap (Priority Queue)"
HARD,Minimum Number of Refueling Stops,43.5,0.405574587771098,https://leetcode.com/problems/minimum-number-of-refueling-stops,"Array, Dynamic Programming, Greedy, Heap (Priority Queue)"
HARD,Maximum Running Time of N Computers,43.5,0.4984652362617595,https://leetcode.com/problems/maximum-running-time-of-n-computers,"Array, Binary Search, Greedy, Sorting"
HARD,Patching Array,43.5,0.5350511688984009,https://leetcode.com/problems/patching-array,"Array, Greedy"
