Difficulty,Title,Frequency,Acceptance Rate,Link,Topics
EASY,Valid Word Abbreviation,95.4,0.3685159507201697,https://leetcode.com/problems/valid-word-abbreviation,"Two Pointers, String"
EASY,Valid Palindrome II,92.7,0.4302713929500688,https://leetcode.com/problems/valid-palindrome-ii,"Two Pointers, String, Greedy"
EASY,Merge Sorted Array,88.9,0.5291952052651709,https://leetcode.com/problems/merge-sorted-array,"Array, Two Pointers, Sorting"
EASY,Diameter of Binary Tree,87.1,0.6358636823587297,https://leetcode.com/problems/diameter-of-binary-tree,"Tree, Depth-First Search, Binary Tree"
EASY,Two Sum,83.8,0.5577698896587009,https://leetcode.com/problems/two-sum,"Array, Hash Table"
EASY,Valid Palindrome,81.7,0.5096356689787139,https://leetcode.com/problems/valid-palindrome,"Two Pointers, String"
EASY,Best Time to Buy and Sell Stock,76.4,0.5525965868759138,https://leetcode.com/problems/best-time-to-buy-and-sell-stock,"Array, Dynamic Programming"
EASY,Valid Parentheses,74.9,0.4232281958861704,https://leetcode.com/problems/valid-parentheses,"String, Stack"
EASY,Range Sum of BST,71.9,0.8745394306042865,https://leetcode.com/problems/range-sum-of-bst,"Tree, Depth-First Search, Binary Search Tree, Binary Tree"
EASY,Moving Average from Data Stream,69.9,0.7993882465731537,https://leetcode.com/problems/moving-average-from-data-stream,"Array, Design, Queue, Data Stream"
EASY,Longest Common Prefix,67.0,0.4548305505260665,https://leetcode.com/problems/longest-common-prefix,"String, Trie"
EASY,Kth Missing Positive Number,65.7,0.6228376191332494,https://leetcode.com/problems/kth-missing-positive-number,"Array, Binary Search"
EASY,Add Strings,60.3,0.5190382397212994,https://leetcode.com/problems/add-strings,"Math, String, Simulation"
EASY,Squares of a Sorted Array,59.4,0.7321920614312215,https://leetcode.com/problems/squares-of-a-sorted-array,"Array, Two Pointers, Sorting"
EASY,Remove Duplicates from Sorted Array,59.0,0.6035551112882038,https://leetcode.com/problems/remove-duplicates-from-sorted-array,"Array, Two Pointers"
EASY,Closest Binary Search Tree Value,57.5,0.497662689645014,https://leetcode.com/problems/closest-binary-search-tree-value,"Binary Search, Tree, Depth-First Search, Binary Search Tree, Binary Tree"
EASY,Palindrome Number,57.0,0.5922455573209394,https://leetcode.com/problems/palindrome-number,Math
EASY,Roman to Integer,56.3,0.6486626948713667,https://leetcode.com/problems/roman-to-integer,"Hash Table, Math, String"
EASY,Missing Ranges,56.0,0.3526494595509856,https://leetcode.com/problems/missing-ranges,Array
EASY,Merge Two Sorted Lists,54.2,0.6684091757223755,https://leetcode.com/problems/merge-two-sorted-lists,"Linked List, Recursion"
EASY,Contains Duplicate II,52.9,0.4904986450077176,https://leetcode.com/problems/contains-duplicate-ii,"Array, Hash Table, Sliding Window"
EASY,Climbing Stairs,52.8,0.5354071346208594,https://leetcode.com/problems/climbing-stairs,"Math, Dynamic Programming, Memoization"
EASY,Add Binary,50.8,0.5567698718505886,https://leetcode.com/problems/add-binary,"Math, String, Bit Manipulation, Simulation"
EASY,Plus One,47.5,0.4754760423278756,https://leetcode.com/problems/plus-one,"Array, Math"
EASY,Majority Element,46.0,0.6574028018936169,https://leetcode.com/problems/majority-element,"Array, Hash Table, Divide and Conquer, Sorting, Counting"
EASY,Pascal's Triangle,45.3,0.770215491719448,https://leetcode.com/problems/pascals-triangle,"Array, Dynamic Programming"
EASY,Goat Latin,45.2,0.6935336472329297,https://leetcode.com/problems/goat-latin,String
EASY,Find the Index of the First Occurrence in a String,44.8,0.449715987345429,https://leetcode.com/problems/find-the-index-of-the-first-occurrence-in-a-string,"Two Pointers, String, String Matching"
EASY,Sqrt(x),44.3,0.403718059906665,https://leetcode.com/problems/sqrtx,"Math, Binary Search"
EASY,Remove Element,42.4,0.6003163016310397,https://leetcode.com/problems/remove-element,"Array, Two Pointers"
EASY,Strobogrammatic Number,40.7,0.4760305048749879,https://leetcode.com/problems/strobogrammatic-number,"Hash Table, Two Pointers, String"
EASY,Create Hello World Function,38.3,0.8212977812647828,https://leetcode.com/problems/create-hello-world-function,
EASY,Merge Strings Alternately,38.3,0.8222964639886224,https://leetcode.com/problems/merge-strings-alternately,"Two Pointers, String"
EASY,Maximum Depth of Binary Tree,36.8,0.7713813520613833,https://leetcode.com/problems/maximum-depth-of-binary-tree,"Tree, Depth-First Search, Breadth-First Search, Binary Tree"
EASY,Minimum Depth of Binary Tree,36.8,0.506666811649461,https://leetcode.com/problems/minimum-depth-of-binary-tree,"Tree, Depth-First Search, Breadth-First Search, Binary Tree"
EASY,Move Zeroes,35.4,0.6280400947352507,https://leetcode.com/problems/move-zeroes,"Array, Two Pointers"
EASY,Recyclable and Low Fat Products,35.4,0.8925494047235137,https://leetcode.com/problems/recyclable-and-low-fat-products,Database
EASY,Binary Tree Inorder Traversal,34.5,0.7858399006715053,https://leetcode.com/problems/binary-tree-inorder-traversal,"Stack, Tree, Depth-First Search, Binary Tree"
EASY,Search Insert Position,33.6,0.4901242260459721,https://leetcode.com/problems/search-insert-position,"Array, Binary Search"
EASY,Reverse Linked List,32.3,0.7920653809770642,https://leetcode.com/problems/reverse-linked-list,"Linked List, Recursion"
EASY,Add Two Integers,32.0,0.8812227852771523,https://leetcode.com/problems/add-two-integers,Math
EASY,Range Sum Query - Immutable,32.0,0.6854760707055493,https://leetcode.com/problems/range-sum-query-immutable,"Array, Design, Prefix Sum"
EASY,Toeplitz Matrix,32.0,0.6939253887597988,https://leetcode.com/problems/toeplitz-matrix,"Array, Matrix"
EASY,Length of Last Word,31.6,0.5631926112536397,https://leetcode.com/problems/length-of-last-word,String
EASY,Symmetric Tree,30.6,0.5927867908424697,https://leetcode.com/problems/symmetric-tree,"Tree, Depth-First Search, Breadth-First Search, Binary Tree"
EASY,Convert Sorted Array to Binary Search Tree,26.9,0.7407934506434607,https://leetcode.com/problems/convert-sorted-array-to-binary-search-tree,"Array, Divide and Conquer, Tree, Binary Search Tree, Binary Tree"
EASY,Same Tree,26.9,0.651268811570624,https://leetcode.com/problems/same-tree,"Tree, Depth-First Search, Breadth-First Search, Binary Tree"
EASY,Path Sum,24.9,0.5300478045423143,https://leetcode.com/problems/path-sum,"Tree, Depth-First Search, Breadth-First Search, Binary Tree"
EASY,Contains Duplicate,24.1,0.6323637545143186,https://leetcode.com/problems/contains-duplicate,"Array, Hash Table, Sorting"
EASY,Single Number,24.1,0.7596882403268375,https://leetcode.com/problems/single-number,"Array, Bit Manipulation"
EASY,Balanced Binary Tree,22.3,0.5534202381170411,https://leetcode.com/problems/balanced-binary-tree,"Tree, Depth-First Search, Binary Tree"
EASY,Pascal's Triangle II,14.1,0.6595100107835754,https://leetcode.com/problems/pascals-triangle-ii,"Array, Dynamic Programming"
MEDIUM,Minimum Remove to Make Valid Parentheses,100.0,0.7074654274676669,https://leetcode.com/problems/minimum-remove-to-make-valid-parentheses,"String, Stack"
MEDIUM,Kth Largest Element in an Array,93.6,0.6797700117160972,https://leetcode.com/problems/kth-largest-element-in-an-array,"Array, Divide and Conquer, Sorting, Heap (Priority Queue), Quickselect"
MEDIUM,Binary Tree Vertical Order Traversal,93.4,0.5714118828755629,https://leetcode.com/problems/binary-tree-vertical-order-traversal,"Hash Table, Tree, Depth-First Search, Breadth-First Search, Sorting, Binary Tree"
MEDIUM,Lowest Common Ancestor of a Binary Tree III,89.6,0.8246671008016527,https://leetcode.com/problems/lowest-common-ancestor-of-a-binary-tree-iii,"Hash Table, Two Pointers, Tree, Binary Tree"
MEDIUM,"Pow(x, n)",87.9,0.3702319433830264,https://leetcode.com/problems/powx-n,"Math, Recursion"
MEDIUM,Simplify Path,86.6,0.4785432317744196,https://leetcode.com/problems/simplify-path,"String, Stack"
MEDIUM,Basic Calculator II,86.2,0.4581129812287864,https://leetcode.com/problems/basic-calculator-ii,"Math, String, Stack"
MEDIUM,Binary Tree Right Side View,86.0,0.6704254068229247,https://leetcode.com/problems/binary-tree-right-side-view,"Tree, Depth-First Search, Breadth-First Search, Binary Tree"
MEDIUM,Find Peak Element,85.8,0.4650925742800201,https://leetcode.com/problems/find-peak-element,"Array, Binary Search"
MEDIUM,Merge Intervals,84.9,0.4939526774846352,https://leetcode.com/problems/merge-intervals,"Array, Sorting"
MEDIUM,Buildings With an Ocean View,84.3,0.8076970293771174,https://leetcode.com/problems/buildings-with-an-ocean-view,"Array, Stack, Monotonic Stack"
MEDIUM,Lowest Common Ancestor of a Binary Tree,84.1,0.6675499347216417,https://leetcode.com/problems/lowest-common-ancestor-of-a-binary-tree,"Tree, Depth-First Search, Binary Tree"
MEDIUM,Nested List Weight Sum,83.5,0.8554000344037734,https://leetcode.com/problems/nested-list-weight-sum,"Depth-First Search, Breadth-First Search"
MEDIUM,Random Pick with Weight,83.0,0.4827836751158982,https://leetcode.com/problems/random-pick-with-weight,"Array, Math, Binary Search, Prefix Sum, Randomized"
MEDIUM,Subarray Sum Equals K,82.7,0.4547621523795086,https://leetcode.com/problems/subarray-sum-equals-k,"Array, Hash Table, Prefix Sum"
MEDIUM,3Sum,80.9,0.3707095392707933,https://leetcode.com/problems/3sum,"Array, Two Pointers, Sorting"
MEDIUM,Sum Root to Leaf Numbers,80.5,0.6852760683519554,https://leetcode.com/problems/sum-root-to-leaf-numbers,"Tree, Depth-First Search, Binary Tree"
MEDIUM,Next Permutation,79.2,0.4305773671839413,https://leetcode.com/problems/next-permutation,"Array, Two Pointers"
MEDIUM,Shortest Path in Binary Matrix,79.1,0.4978881815967513,https://leetcode.com/problems/shortest-path-in-binary-matrix,"Array, Breadth-First Search, Matrix"
MEDIUM,Copy List with Random Pointer,78.8,0.6053669280147949,https://leetcode.com/problems/copy-list-with-random-pointer,"Hash Table, Linked List"
MEDIUM,Top K Frequent Elements,78.7,0.6456597479097793,https://leetcode.com/problems/top-k-frequent-elements,"Array, Hash Table, Divide and Conquer, Sorting, Heap (Priority Queue), Bucket Sort, Counting, Quickselect"
MEDIUM,LRU Cache,76.0,0.4521454488123034,https://leetcode.com/problems/lru-cache,"Hash Table, Linked List, Design, Doubly-Linked List"
MEDIUM,Custom Sort String,73.2,0.7200455390359645,https://leetcode.com/problems/custom-sort-string,"Hash Table, String, Sorting"
MEDIUM,Find First and Last Position of Element in Sorted Array,72.1,0.4682873183580639,https://leetcode.com/problems/find-first-and-last-position-of-element-in-sorted-array,"Array, Binary Search"
MEDIUM,Clone Graph,71.4,0.6238577114061011,https://leetcode.com/problems/clone-graph,"Hash Table, Depth-First Search, Breadth-First Search, Graph"
MEDIUM,K Closest Points to Origin,71.4,0.6793957161103558,https://leetcode.com/problems/k-closest-points-to-origin,"Array, Math, Divide and Conquer, Geometry, Sorting, Heap (Priority Queue), Quickselect"
MEDIUM,Dot Product of Two Sparse Vectors,70.9,0.899342220834228,https://leetcode.com/problems/dot-product-of-two-sparse-vectors,"Array, Hash Table, Two Pointers, Design"
MEDIUM,Minimum Add to Make Parentheses Valid,68.8,0.746908249713867,https://leetcode.com/problems/minimum-add-to-make-parentheses-valid,"String, Stack, Greedy"
MEDIUM,Max Consecutive Ones III,67.6,0.6593931819579935,https://leetcode.com/problems/max-consecutive-ones-iii,"Array, Binary Search, Sliding Window, Prefix Sum"
MEDIUM,Letter Combinations of a Phone Number,67.0,0.6385756647080152,https://leetcode.com/problems/letter-combinations-of-a-phone-number,"Hash Table, String, Backtracking"
MEDIUM,Interval List Intersections,66.3,0.7267720917127461,https://leetcode.com/problems/interval-list-intersections,"Array, Two Pointers, Line Sweep"
MEDIUM,Add Two Numbers,66.0,0.4622507231988566,https://leetcode.com/problems/add-two-numbers,"Linked List, Math, Recursion"
MEDIUM,Maximum Swap,65.7,0.5184838353958446,https://leetcode.com/problems/maximum-swap,"Math, Greedy"
MEDIUM,Remove Nth Node From End of List,65.1,0.4896103052563428,https://leetcode.com/problems/remove-nth-node-from-end-of-list,"Linked List, Two Pointers"
MEDIUM,Subsets,65.1,0.808795565390318,https://leetcode.com/problems/subsets,"Array, Backtracking, Bit Manipulation"
MEDIUM,Longest Substring Without Repeating Characters,63.3,0.3693616554948768,https://leetcode.com/problems/longest-substring-without-repeating-characters,"Hash Table, String, Sliding Window"
MEDIUM,Accounts Merge,62.4,0.5957992244722102,https://leetcode.com/problems/accounts-merge,"Array, Hash Table, String, Depth-First Search, Breadth-First Search, Union Find, Sorting"
MEDIUM,Diagonal Traverse,62.0,0.6317316383591203,https://leetcode.com/problems/diagonal-traverse,"Array, Matrix, Simulation"
MEDIUM,String to Integer (atoi),60.3,0.1922942349527772,https://leetcode.com/problems/string-to-integer-atoi,String
MEDIUM,Course Schedule,59.8,0.4923425308395746,https://leetcode.com/problems/course-schedule,"Depth-First Search, Breadth-First Search, Graph, Topological Sort"
MEDIUM,Longest Palindromic Substring,59.5,0.3584611475412551,https://leetcode.com/problems/longest-palindromic-substring,"Two Pointers, String, Dynamic Programming"
MEDIUM,Insert into a Sorted Circular Linked List,59.4,0.3812431966769732,https://leetcode.com/problems/insert-into-a-sorted-circular-linked-list,Linked List
MEDIUM,Exclusive Time of Functions,57.5,0.6479177009848633,https://leetcode.com/problems/exclusive-time-of-functions,"Array, Stack"
MEDIUM,Binary Search Tree Iterator,57.0,0.7486926503064439,https://leetcode.com/problems/binary-search-tree-iterator,"Stack, Tree, Design, Binary Search Tree, Binary Tree, Iterator"
MEDIUM,Search in Rotated Sorted Array,57.0,0.428372264490035,https://leetcode.com/problems/search-in-rotated-sorted-array,"Array, Binary Search"
MEDIUM,Count and Say,54.6,0.6050656775612677,https://leetcode.com/problems/count-and-say,String
MEDIUM,Palindromic Substrings,54.2,0.7167859571435372,https://leetcode.com/problems/palindromic-substrings,"Two Pointers, String, Dynamic Programming"
MEDIUM,Group Anagrams,53.6,0.709288271723063,https://leetcode.com/problems/group-anagrams,"Array, Hash Table, String, Sorting"
MEDIUM,Container With Most Water,52.9,0.5778282574410597,https://leetcode.com/problems/container-with-most-water,"Array, Two Pointers, Greedy"
MEDIUM,Maximum Subarray,52.1,0.5209978310902755,https://leetcode.com/problems/maximum-subarray,"Array, Divide and Conquer, Dynamic Programming"
MEDIUM,Continuous Subarray Sum,51.6,0.3091089982532908,https://leetcode.com/problems/continuous-subarray-sum,"Array, Hash Table, Math, Prefix Sum"
MEDIUM,Number of Islands,51.5,0.6231991397851002,https://leetcode.com/problems/number-of-islands,"Array, Depth-First Search, Breadth-First Search, Union Find, Matrix"
MEDIUM,Set Matrix Zeroes,51.2,0.6070877520170048,https://leetcode.com/problems/set-matrix-zeroes,"Array, Hash Table, Matrix"
MEDIUM,Sort Colors,51.2,0.6758312948649591,https://leetcode.com/problems/sort-colors,"Array, Two Pointers, Sorting"
MEDIUM,Multiply Strings,50.1,0.4228941429852704,https://leetcode.com/problems/multiply-strings,"Math, String, Simulation"
MEDIUM,Rotate Image,49.5,0.7790164518819447,https://leetcode.com/problems/rotate-image,"Array, Math, Matrix"
MEDIUM,Reverse Integer,49.4,0.3030891688448359,https://leetcode.com/problems/reverse-integer,Math
MEDIUM,Flatten Binary Tree to Linked List,49.0,0.6851010744073592,https://leetcode.com/problems/flatten-binary-tree-to-linked-list,"Linked List, Stack, Tree, Depth-First Search, Binary Tree"
MEDIUM,Populating Next Right Pointers in Each Node,48.4,0.6544147769490073,https://leetcode.com/problems/populating-next-right-pointers-in-each-node,"Linked List, Tree, Depth-First Search, Breadth-First Search, Binary Tree"
MEDIUM,Word Search,48.3,0.4526691452685235,https://leetcode.com/problems/word-search,"Array, String, Backtracking, Depth-First Search, Matrix"
MEDIUM,Word Break,48.0,0.4827376415593891,https://leetcode.com/problems/word-break,"Array, Hash Table, String, Dynamic Programming, Trie, Memoization"
MEDIUM,Spiral Matrix,47.8,0.5393972222908261,https://leetcode.com/problems/spiral-matrix,"Array, Matrix, Simulation"
MEDIUM,Generate Parentheses,47.5,0.7713286717803378,https://leetcode.com/problems/generate-parentheses,"String, Dynamic Programming, Backtracking"
MEDIUM,All Nodes Distance K in Binary Tree,47.0,0.6644209088421342,https://leetcode.com/problems/all-nodes-distance-k-in-binary-tree,"Hash Table, Tree, Depth-First Search, Breadth-First Search, Binary Tree"
MEDIUM,Convert Binary Search Tree to Sorted Doubly Linked List,47.0,0.6548384486360829,https://leetcode.com/problems/convert-binary-search-tree-to-sorted-doubly-linked-list,"Linked List, Stack, Tree, Depth-First Search, Binary Search Tree, Binary Tree, Doubly-Linked List"
MEDIUM,Group Shifted Strings,47.0,0.6737816434506879,https://leetcode.com/problems/group-shifted-strings,"Array, Hash Table, String"
MEDIUM,Divide Two Integers,46.0,0.1839695925531706,https://leetcode.com/problems/divide-two-integers,"Math, Bit Manipulation"
MEDIUM,Insert Interval,45.3,0.4347361196230839,https://leetcode.com/problems/insert-interval,Array
MEDIUM,Binary Tree Zigzag Level Order Traversal,44.6,0.6168283891746636,https://leetcode.com/problems/binary-tree-zigzag-level-order-traversal,"Tree, Breadth-First Search, Binary Tree"
MEDIUM,Search a 2D Matrix,43.3,0.5228955161093151,https://leetcode.com/problems/search-a-2d-matrix,"Array, Binary Search, Matrix"
MEDIUM,Binary Tree Level Order Traversal,42.7,0.7059658947038693,https://leetcode.com/problems/binary-tree-level-order-traversal,"Tree, Breadth-First Search, Binary Tree"
MEDIUM,3Sum Closest,42.4,0.468869600214817,https://leetcode.com/problems/3sum-closest,"Array, Two Pointers, Sorting"
MEDIUM,Jump Game,42.4,0.3947920375919359,https://leetcode.com/problems/jump-game,"Array, Dynamic Programming, Greedy"
MEDIUM,Remove Duplicates from Sorted Array II,42.2,0.6290181029288465,https://leetcode.com/problems/remove-duplicates-from-sorted-array-ii,"Array, Two Pointers"
MEDIUM,Unique Paths,42.2,0.6577283527258664,https://leetcode.com/problems/unique-paths,"Math, Dynamic Programming, Combinatorics"
MEDIUM,Validate Binary Search Tree,41.0,0.3438038788666115,https://leetcode.com/problems/validate-binary-search-tree,"Tree, Depth-First Search, Binary Search Tree, Binary Tree"
MEDIUM,Product of Two Run-Length Encoded Arrays,40.9,0.5940261418418568,https://leetcode.com/problems/product-of-two-run-length-encoded-arrays,"Array, Two Pointers"
MEDIUM,Random Pick Index,40.9,0.6453914001449079,https://leetcode.com/problems/random-pick-index,"Hash Table, Math, Reservoir Sampling, Randomized"
MEDIUM,Capacity To Ship Packages Within D Days,40.7,0.7211742019720978,https://leetcode.com/problems/capacity-to-ship-packages-within-d-days,"Array, Binary Search"
MEDIUM,Car Pooling,40.7,0.5604985308033269,https://leetcode.com/problems/car-pooling,"Array, Sorting, Heap (Priority Queue), Simulation, Prefix Sum"
MEDIUM,Cutting Ribbons,40.7,0.5262837947933771,https://leetcode.com/problems/cutting-ribbons,"Array, Binary Search"
MEDIUM,Kth Smallest Element in a Sorted Matrix,40.7,0.6356660329525441,https://leetcode.com/problems/kth-smallest-element-in-a-sorted-matrix,"Array, Binary Search, Sorting, Heap (Priority Queue), Matrix"
MEDIUM,Managers with at Least 5 Direct Reports,40.7,0.4893990626627321,https://leetcode.com/problems/managers-with-at-least-5-direct-reports,Database
MEDIUM,Zero Array Transformation III,40.7,0.5538003960577724,https://leetcode.com/problems/zero-array-transformation-iii,"Array, Greedy, Sorting, Heap (Priority Queue), Prefix Sum"
MEDIUM,Best Time to Buy and Sell Stock II,39.8,0.6950023404506479,https://leetcode.com/problems/best-time-to-buy-and-sell-stock-ii,"Array, Dynamic Programming, Greedy"
MEDIUM,Combination Sum,39.8,0.746747008868086,https://leetcode.com/problems/combination-sum,"Array, Backtracking"
MEDIUM,Decode Ways,39.8,0.3653098525409497,https://leetcode.com/problems/decode-ways,"String, Dynamic Programming"
MEDIUM,Valid Sudoku,39.8,0.6227677721538815,https://leetcode.com/problems/valid-sudoku,"Array, Hash Table, Matrix"
MEDIUM,Rotate Array,39.6,0.4302137279999349,https://leetcode.com/problems/rotate-array,"Array, Math, Two Pointers"
MEDIUM,Two Sum II - Input Array Is Sorted,39.6,0.6340212808989598,https://leetcode.com/problems/two-sum-ii-input-array-is-sorted,"Array, Two Pointers, Binary Search"
MEDIUM,Unique Paths II,38.9,0.4315436499772203,https://leetcode.com/problems/unique-paths-ii,"Array, Dynamic Programming, Matrix"
MEDIUM,Lowest Common Ancestor of a Binary Search Tree,38.3,0.6831069193376744,https://leetcode.com/problems/lowest-common-ancestor-of-a-binary-search-tree,"Tree, Depth-First Search, Binary Search Tree, Binary Tree"
MEDIUM,Longest Consecutive Sequence,38.0,0.4704082801866521,https://leetcode.com/problems/longest-consecutive-sequence,"Array, Hash Table, Union Find"
MEDIUM,Path Sum II,37.9,0.6049772910946117,https://leetcode.com/problems/path-sum-ii,"Backtracking, Tree, Depth-First Search, Binary Tree"
MEDIUM,Permutations,37.9,0.8066011364163758,https://leetcode.com/problems/permutations,"Array, Backtracking"
MEDIUM,4Sum,37.0,0.3821902011379304,https://leetcode.com/problems/4sum,"Array, Two Pointers, Sorting"
MEDIUM,Subsets II,37.0,0.595072748658621,https://leetcode.com/problems/subsets-ii,"Array, Backtracking, Bit Manipulation"
MEDIUM,Zigzag Conversion,36.2,0.5160676713980508,https://leetcode.com/problems/zigzag-conversion,String
MEDIUM,Design Tic-Tac-Toe,35.4,0.5860139660881724,https://leetcode.com/problems/design-tic-tac-toe,"Array, Hash Table, Design, Matrix, Simulation"
MEDIUM,Find K Closest Elements,35.4,0.486686656754684,https://leetcode.com/problems/find-k-closest-elements,"Array, Two Pointers, Binary Search, Sliding Window, Sorting, Heap (Priority Queue)"
MEDIUM,Meeting Rooms II,35.4,0.521416981510797,https://leetcode.com/problems/meeting-rooms-ii,"Array, Two Pointers, Greedy, Sorting, Heap (Priority Queue), Prefix Sum"
MEDIUM,Product of Array Except Self,35.4,0.6777994606301018,https://leetcode.com/problems/product-of-array-except-self,"Array, Prefix Sum"
MEDIUM,Combination Sum II,34.5,0.5767453180420465,https://leetcode.com/problems/combination-sum-ii,"Array, Backtracking"
MEDIUM,Construct Binary Tree from Preorder and Inorder Traversal,33.6,0.6683774773521286,https://leetcode.com/problems/construct-binary-tree-from-preorder-and-inorder-traversal,"Array, Hash Table, Divide and Conquer, Tree, Binary Tree"
MEDIUM,Jump Game II,33.6,0.4150320105538864,https://leetcode.com/problems/jump-game-ii,"Array, Dynamic Programming, Greedy"
MEDIUM,Edit Distance,33.2,0.5878974125922288,https://leetcode.com/problems/edit-distance,"String, Dynamic Programming"
MEDIUM,Reverse Linked List II,33.2,0.4959173627933516,https://leetcode.com/problems/reverse-linked-list-ii,Linked List
MEDIUM,Rotate List,32.6,0.3994477271612808,https://leetcode.com/problems/rotate-list,"Linked List, Two Pointers"
MEDIUM,Search in Rotated Sorted Array II,32.6,0.3887965146188378,https://leetcode.com/problems/search-in-rotated-sorted-array-ii,"Array, Binary Search"
MEDIUM,Decode String,32.0,0.6115249906697672,https://leetcode.com/problems/decode-string,"String, Stack, Recursion"
MEDIUM,Frequency of the Most Frequent Element,32.0,0.4410284958914792,https://leetcode.com/problems/frequency-of-the-most-frequent-element,"Array, Binary Search, Greedy, Sliding Window, Sorting, Prefix Sum"
MEDIUM,Koko Eating Bananas,32.0,0.4906727853934328,https://leetcode.com/problems/koko-eating-bananas,"Array, Binary Search"
MEDIUM,Kth Smallest Element in a BST,32.0,0.7532956790739447,https://leetcode.com/problems/kth-smallest-element-in-a-bst,"Tree, Depth-First Search, Binary Search Tree, Binary Tree"
MEDIUM,Remove All Adjacent Duplicates in String II,32.0,0.5960160384923817,https://leetcode.com/problems/remove-all-adjacent-duplicates-in-string-ii,"String, Stack"
MEDIUM,Shortest Path in a Hidden Grid,32.0,0.4426654301456549,https://leetcode.com/problems/shortest-path-in-a-hidden-grid,"Array, Depth-First Search, Breadth-First Search, Matrix, Interactive"
MEDIUM,Restore IP Addresses,31.8,0.531583393083398,https://leetcode.com/problems/restore-ip-addresses,"String, Backtracking"
MEDIUM,Swap Nodes in Pairs,30.3,0.6720136828647639,https://leetcode.com/problems/swap-nodes-in-pairs,"Linked List, Recursion"
MEDIUM,Course Schedule II,29.9,0.5342350291611208,https://leetcode.com/problems/course-schedule-ii,"Depth-First Search, Breadth-First Search, Graph, Topological Sort"
MEDIUM,Minimum Size Subarray Sum,29.9,0.4939106484793931,https://leetcode.com/problems/minimum-size-subarray-sum,"Array, Binary Search, Sliding Window, Prefix Sum"
MEDIUM,Reverse Words in a String,29.9,0.5191326197169353,https://leetcode.com/problems/reverse-words-in-a-string,"Two Pointers, String"
MEDIUM,Convert Sorted List to Binary Search Tree,26.9,0.6445920225309912,https://leetcode.com/problems/convert-sorted-list-to-binary-search-tree,"Linked List, Divide and Conquer, Tree, Binary Search Tree, Binary Tree"
MEDIUM,Integer to Roman,26.9,0.6861931275088928,https://leetcode.com/problems/integer-to-roman,"Hash Table, Math, String"
MEDIUM,Find Minimum in Rotated Sorted Array,24.1,0.5264825291581084,https://leetcode.com/problems/find-minimum-in-rotated-sorted-array,"Array, Binary Search"
MEDIUM,House Robber,24.1,0.5230497813640642,https://leetcode.com/problems/house-robber,"Array, Dynamic Programming"
MEDIUM,Palindrome Partitioning,24.1,0.7212808256354587,https://leetcode.com/problems/palindrome-partitioning,"String, Dynamic Programming, Backtracking"
MEDIUM,Combinations,24.0,0.7289646493270955,https://leetcode.com/problems/combinations,Backtracking
MEDIUM,Minimum Path Sum,22.3,0.664814934885504,https://leetcode.com/problems/minimum-path-sum,"Array, Dynamic Programming, Matrix"
MEDIUM,Permutations II,20.2,0.615917727605333,https://leetcode.com/problems/permutations-ii,"Array, Backtracking, Sorting"
